<?xml version="1.0" encoding="UTF-8"?>
<!DOCTYPE groups SYSTEM "http://rapid-framework.googlecode.com/svn/trunk/dtd/groups.dtd">
<groups>

	<comment></comment>
	
	<group name="g1">
		<property key="g1_1">v1_1</property>
		<property key="g1_2">v1_2</property>
		<property key="1">v1</property>
	</group>
	
	<group name="g2">
		<property key="g2_1">v2_1</property>
		<property key="g2_2">v2_2</property>
		<property key="1">v1</property>
	</group>	
	
</groups>