<?xml version="1.0" encoding="UTF-8"?>
<!DOCTYPE groups SYSTEM "http://rapid-framework.googlecode.com/svn/trunk/dtd/groups.dtd">
<groups>

	<comment>12123</comment>
	
	<group name="findByPage">
		<property name="g1_1">v1_1</property>
		<property name="g1_2">v1_2</property>
		<property name="1">v1</property>
	</group>

	<group name="UserInfo">
		<property name="deleteBySql">
			select * from user where username = :username
		</property>
		<property name="insertBySql">
			select * from blog where age = :age
		</property>
		<property name="update">
			select * from blog where hibernate=:hibernate
		</property>
	</group>	
	
</groups>