<?xml version="1.0" encoding="UTF-8"?>
<!DOCTYPE groups SYSTEM "http://rapid-framework.googlecode.com/svn/trunk/dtd/groups.dtd">
<groups>

	<comment>12123</comment>
	
	<group name="g1">
		<property name="g1_1">v1_1</property>
		<property name="g1_2">v1_2</property>
		<property name="1">v1</property>
	</group>

	<group name="g2">
		<property name="g2_1">v2_1</property>
		<property name="g2_2">v2_2</property>
		<property name="1">v1</property>
	</group>	
	
</groups>